{
  "core": ["internal/core/**", "src/core/**"],
  "shell": ["internal/shell/**", "cmd/**", "src/shell/**", "src/main.ts"],
  "exclude": [],
  "mode": "deny",
  "stopCheck": "changed",
  "profile": "service",
  "designDir": "docs/design",
  "verify": { "command": "go test ./internal/core/...", "timeout": 120 },
  "rules": {
    "go": { "forbidImports": [], "allowImports": [], "forbidCalls": [] },
    "ts": { "forbidImports": [], "allowImports": [], "forbidCalls": [] }
  }
}
